1015238   2.050451 183.159.145.101 -> 1.108.204.24 TCP 50 51784→443 [ACK] Seq=233 Ack=2721 Win=17680 Len=0
1015239   2.050452 117.89.15.57 -> 43.252.226.16 TCP 56 [TCP Dup ACK 936915#82] 58178→80 [ACK] Seq=1 Ack=1425313 Win=4129 Len=0 SLE=1426727 SRE=1544089
1015240   2.050457 214.96.127.56 -> 153.193.46.245 TCP 56 48782→80 [ACK] Seq=1220 Ack=204169 Win=246304 Len=0 TSval=3237244430 TSecr=3637029532
1015241   2.050458 111.37.227.183 -> 1.153.157.182 TCP 1444 17257→80 [PSH, ACK] Seq=1402 Ack=391 Win=31744 Len=1400
1015242   2.050465 112.65.18.81 -> 1.96.166.240 TCP 1484 37828→443 [ACK] Seq=1193761 Ack=1 Win=8192 Len=1440
1015243   2.050468 157.114.101.247 -> 104.239.136.145 UDP 1457 Source port: 13487  Destination port: 40327[Packet size limited during capture]
1015244   2.050469 99.141.153.243 -> 43.252.224.74 TCP 56 14512→443 [ACK] Seq=668 Ack=1369 Win=3293 Len=0 TSval=99657747 TSecr=627055030
1015245   2.050469 198.85.16.230 -> 43.252.224.74 TCP 56 14512→443 [ACK] Seq=668 Ack=2737 Win=3336 Len=0 TSval=99657747 TSecr=627055030