  1   0.000000 111.37.227.254 -> 1.148.201.155 TCP 50 28837→80 [ACK] Seq=1 Ack=1 Win=125 Len=0
  2   0.000004 128.42.32.38 -> 1.96.166.181 TCP 1484 7174→443 [ACK] Seq=1 Ack=1 Win=8192 Len=1440
  3   0.000006 101.133.64.239 -> 5.252.100.69 TCP 56 3695→8004 [ACK] Seq=1 Ack=1 Win=32044 Len=0 TSval=630558670 TSecr=3263295206
  4   0.000019 109.147.8.86 -> 1.152.171.145 TCP 56 58387→9339 [ACK] Seq=1 Ack=1 Win=12267 Len=0 TSval=4919981 TSecr=650163919
  5   0.000020 119.226.192.68 -> 1.96.166.199 TCP 1484 24734→443 [ACK] Seq=1 Ack=1 Win=8192 Len=1440
  6   0.000036 121.36.251.209 -> 1.96.166.240 TCP 1504 22110→443 [ACK] Seq=1 Ack=1 Win=8192 Len=1460
  7   0.000038 118.178.44.143 -> 1.107.142.244 TCP 56 48935→443 [ACK] Seq=1 Ack=1 Win=1686 Len=0 TSval=7781185 TSecr=3406855798
  8   0.000039 58.13.161.116 -> 153.193.47.116 TCP 1341 63740→443 [PSH, ACK] Seq=1 Ack=1 Win=32723 Len=1285 TSval=2394400911 TSecr=2927766035
  9   0.000041 72.189.201.155 -> 111.205.228.241 UDP 78 Source port: 49287  Destination port: 8080[Packet size limited during capture]
 10   0.000041 137.195.64.142 -> 198.85.16.230 TCP 50 55446→80 [ACK] Seq=1 Ack=1 Win=10406 Len=0